2015maspr_0,District Chairman's Award,frc178,
2015maspr_1,District Event Winner,frc3146,
2015maspr_1,District Event Winner,frc3718,
2015maspr_1,District Event Winner,frc2168,
2015maspr_10,Rookie All Star Award,frc5782,
2015maspr_11,Gracious Professionalism Award sponsored by Johnson & Johnson,frc166,
2015maspr_13,Judges' Award,frc213,
2015maspr_14,Highest Rookie Seed,frc5782,
2015maspr_16,Industrial Design Award sponsored by General Motors,frc175,
2015maspr_17,Quality Award sponsored by Motorola,frc839,
2015maspr_18,Industrial Safety Award sponsored by Underwriters Laboratories,frc839,
2015maspr_2,District Event Finalist,frc316,
2015maspr_2,District Event Finalist,frc61,
2015maspr_2,District Event Finalist,frc663,
2015maspr_20,Creativity Award sponsored by Xerox,frc716,
2015maspr_21,Excellence in Engineering Award sponsored by Delphi,frc61,
2015maspr_22,Entrepreneurship Award sponsored by Kleiner Perkins Caufield and Byers,frc177,
2015maspr_27,Imagery Award in honor of Jack Kamen,frc316,
2015maspr_29,Innovation in Control Award sponsored by Rockwell Automation,frc2370,
2015maspr_30,Team Spirit Award sponsored by Chrysler,frc501,
2015maspr_9,District Engineering Inspiration Award,frc176,
