2017azpx_0,Regional Chairman's Award,frc1165,
2017azpx_1,Regional Winners,frc330,
2017azpx_1,Regional Winners,frc3255,
2017azpx_1,Regional Winners,frc4841,
2017azpx_10,Rookie All Star Award,frc6413,
2017azpx_11,Gracious Professionalism Award sponsored by Johnson & Johnson,frc3019,
2017azpx_13,Judges' Award,frc6352,
2017azpx_14,Highest Rookie Seed,frc6314,
2017azpx_15,Rookie Inspiration Award sponsored by National Instruments,frc6683,
2017azpx_16,Industrial Design Award sponsored by General Motors,frc2403,
2017azpx_17,Quality Award sponsored by Motorola Solutions Foundation,frc3255,
2017azpx_18,Safety Award sponsored by Underwriters Laboratories,frc3019,
2017azpx_2,Regional Finalists,frc6314,
2017azpx_2,Regional Finalists,frc2478,
2017azpx_2,Regional Finalists,frc3019,
2017azpx_20,Creativity Award sponsored by Xerox,frc1492,
2017azpx_21,Excellence in Engineering Award sponsored by Delphi,frc1726,
2017azpx_22,Entrepreneurship Award sponsored by Kleiner Perkins Caufield and Byers,frc6314,
2017azpx_27,Imagery Award in honor of Jack Kamen,frc2449,
2017azpx_29,Innovation in Control Award sponsored by Rockwell Automation,frc330,
2017azpx_3,Woodie Flowers Finalist Award,frc6314,Rich Simoncic
2017azpx_3,Woodie Flowers Finalist Award,frc3019,Rich Simoncic
2017azpx_30,Team Spirit Award sponsored by FCA Foundation,frc2375,
2017azpx_4,FIRST Dean's List Finalist Award,frc698,Luke Fink
2017azpx_4,FIRST Dean's List Finalist Award,frc696,Karin Najarian
2017azpx_5,Volunteer of the Year,frc6314,Corey  Simoncic
2017azpx_68,Wildcard,frc2478,
2017azpx_68,Wildcard,frc3019,
2017azpx_9,Regional Engineering Inspiration Award,frc4841,
