2017marea_0,District Chairman's Award,frc2648,
2017marea_1,District Event Winner,frc4761,
2017marea_1,District Event Winner,frc1071,
2017marea_1,District Event Winner,frc5556,
2017marea_10,Rookie All Star Award,frc6324,
2017marea_11,Gracious Professionalism Award sponsored by Johnson & Johnson,frc58,
2017marea_13,Judges' Award,frc6762,
2017marea_14,Highest Rookie Seed,frc6731,
2017marea_15,Rookie Inspiration Award sponsored by National Instruments,frc6731,
2017marea_16,Industrial Design Award sponsored by General Motors,frc4906,
2017marea_17,Quality Award sponsored by Motorola Solutions Foundation,frc4909,
2017marea_18,Safety Award sponsored by Underwriters Laboratories,frc173,
2017marea_2,District Event Finalist,frc1721,
2017marea_2,District Event Finalist,frc2648,
2017marea_2,District Event Finalist,frc4169,
2017marea_20,Creativity Award sponsored by Xerox,frc1721,
2017marea_21,Excellence in Engineering Award sponsored by Delphi,frc5735,
2017marea_22,Entrepreneurship Award sponsored by Kleiner Perkins Caufield and Byers,frc3930,
2017marea_27,Imagery Award in honor of Jack Kamen,frc5122,
2017marea_29,Innovation in Control Award sponsored by Rockwell Automation,frc4564,
2017marea_30,Team Spirit Award sponsored by FCA Foundation,frc2713,
2017marea_9,District Engineering Inspiration Award,frc4761,
