2016mndu2_0,Regional Chairman's Award,frc3132,
2016mndu2_1,Regional Winners,frc2883,
2016mndu2_1,Regional Winners,frc2502,
2016mndu2_1,Regional Winners,frc5232,
2016mndu2_10,Rookie All Star Award,frc6166,
2016mndu2_11,Gracious Professionalism Award sponsored by Johnson & Johnson,frc2883,
2016mndu2_13,Judges' Award,frc3054,
2016mndu2_14,Highest Rookie Seed,frc6166,
2016mndu2_15,Rookie Inspiration Award sponsored by National Instruments,frc5929,
2016mndu2_16,Industrial Design Award sponsored by General Motors,frc876,
2016mndu2_17,Quality Award sponsored by Motorola Solutions Foundation,frc930,
2016mndu2_18,Industrial Safety Award sponsored by Underwriters Laboratories,frc3132,
2016mndu2_2,Regional Finalists,frc2987,
2016mndu2_2,Regional Finalists,frc5172,
2016mndu2_2,Regional Finalists,frc3267,
2016mndu2_20,Creativity Award sponsored by Xerox,frc4624,
2016mndu2_21,Excellence in Engineering Award sponsored by Delphi,frc5172,
2016mndu2_22,Entrepreneurship Award sponsored by Kleiner Perkins Caufield and Byers,frc4786,
2016mndu2_27,Imagery Award in honor of Jack Kamen,frc4656,
2016mndu2_29,Innovation in Control Award sponsored by Rockwell Automation,frc2512,
2016mndu2_3,Woodie Flowers Finalist Award,frc2500,David Sylvestre
2016mndu2_30,Team Spirit Award sponsored by FCA Foundation,frc3042,
2016mndu2_4,FIRST Dean's List Finalist Award,frc2500,Jared Voight
2016mndu2_4,FIRST Dean's List Finalist Award,frc3042,Tabitha Alitz
2016mndu2_5,Volunteer of the Year,,Darrel Baker
2016mndu2_68,Wildcard,frc2987,
2016mndu2_68,Wildcard,frc5172,
2016mndu2_9,Regional Engineering Inspiration Award,frc2502,
