2016azpx_0,Regional Chairman's Award,frc2403,
2016azpx_1,Regional Winners,frc987,
2016azpx_1,Regional Winners,frc2468,
2016azpx_1,Regional Winners,frc3853,
2016azpx_11,Gracious Professionalism Award sponsored by Johnson & Johnson,frc3187,
2016azpx_13,Judges' Award,frc5101,
2016azpx_16,Industrial Design Award sponsored by General Motors,frc1538,
2016azpx_17,Quality Award sponsored by Motorola Solutions Foundation,frc1197,
2016azpx_18,Industrial Safety Award sponsored by Underwriters Laboratories,frc4146,
2016azpx_2,Regional Finalists,frc4183,
2016azpx_2,Regional Finalists,frc1538,
2016azpx_2,Regional Finalists,frc4146,
2016azpx_20,Creativity Award sponsored by Xerox,frc3944,
2016azpx_21,Excellence in Engineering Award sponsored by Delphi,frc4183,
2016azpx_22,Entrepreneurship Award sponsored by Kleiner Perkins Caufield and Byers,frc2468,
2016azpx_27,Imagery Award in honor of Jack Kamen,frc1633,
2016azpx_29,Innovation in Control Award sponsored by Rockwell Automation,frc987,
2016azpx_3,Woodie Flowers Finalist Award,frc968,Richard Medina
2016azpx_30,Team Spirit Award sponsored by FCA Foundation,frc2375,
2016azpx_4,FIRST Dean's List Finalist Award,frc2375,Edwin Lozano
2016azpx_4,FIRST Dean's List Finalist Award,frc1165,Stephen Robertson
2016azpx_5,Volunteer of the Year,,Cindy Stong
2016azpx_68,Wildcard,frc4183,
2016azpx_68,Wildcard,frc4146,
2016azpx_9,Regional Engineering Inspiration Award,frc3019,
