2017micmp2_1,District Championship Winner,frc33,
2017micmp2_1,District Championship Winner,frc2834,
2017micmp2_1,District Championship Winner,frc469,
2017micmp2_11,Gracious Professionalism Award sponsored by Johnson & Johnson,frc3175,
2017micmp2_13,Judges' Award,frc5069,
2017micmp2_14,Highest Rookie Seed,frc6582,
2017micmp2_15,Rookie Inspiration Award sponsored by National Instruments,frc6582,
2017micmp2_16,Industrial Design Award sponsored by General Motors,frc33,
2017micmp2_17,Quality Award sponsored by Motorola Solutions Foundation,frc67,
2017micmp2_18,Safety Award sponsored by Underwriters Laboratories,frc494,
2017micmp2_2,District Championship Finalist,frc67,
2017micmp2_2,District Championship Finalist,frc2960,
2017micmp2_2,District Championship Finalist,frc1684,
2017micmp2_20,Creativity Award sponsored by Xerox,frc1684,
2017micmp2_21,Excellence in Engineering Award sponsored by Delphi,frc2834,
2017micmp2_22,Entrepreneurship Award sponsored by Kleiner Perkins Caufield and Byers,frc245,
2017micmp2_27,Imagery Award in honor of Jack Kamen,frc4325,
2017micmp2_29,Innovation in Control Award sponsored by Rockwell Automation,frc2054,
2017micmp2_30,Team Spirit Award sponsored by FCA Foundation,frc5915,
