2017mdedg_0,District Chairman's Award,frc2537,
2017mdedg_1,District Event Winner,frc5115,
2017mdedg_1,District Event Winner,frc1389,
2017mdedg_1,District Event Winner,frc2534,
2017mdedg_10,Rookie All Star Award,frc6326,
2017mdedg_11,Gracious Professionalism Award sponsored by Johnson & Johnson,frc686,
2017mdedg_13,Judges' Award,frc1915,
2017mdedg_14,Highest Rookie Seed,frc6326,
2017mdedg_15,Rookie Inspiration Award sponsored by National Instruments,frc6504,
2017mdedg_16,Industrial Design Award sponsored by General Motors,frc4505,
2017mdedg_17,Quality Award sponsored by Motorola Solutions Foundation,frc619,
2017mdedg_18,Safety Award sponsored by Underwriters Laboratories,frc6239,
2017mdedg_2,District Event Finalist,frc6239,
2017mdedg_2,District Event Finalist,frc449,
2017mdedg_2,District Event Finalist,frc2421,
2017mdedg_20,Creativity Award sponsored by Xerox,frc4541,
2017mdedg_21,Excellence in Engineering Award sponsored by Delphi,frc3650,
2017mdedg_22,Entrepreneurship Award sponsored by Kleiner Perkins Caufield and Byers,frc1389,
2017mdedg_27,Imagery Award in honor of Jack Kamen,frc2377,
2017mdedg_29,Innovation in Control Award sponsored by Rockwell Automation,frc1123,
2017mdedg_30,Team Spirit Award sponsored by FCA Foundation,frc6239,
2017mdedg_9,District Engineering Inspiration Award,frc5243,
