2016qcmo_0,Regional Chairman's Award,frc3990,
2016qcmo_1,Regional Winners,frc5618,
2016qcmo_1,Regional Winners,frc3990,
2016qcmo_1,Regional Winners,frc3533,
2016qcmo_10,Rookie All Star Award,frc5910,
2016qcmo_11,Gracious Professionalism Award sponsored by Johnson & Johnson,frc3986,
2016qcmo_13,Judges' Award,frc6040,
2016qcmo_14,Highest Rookie Seed,frc5910,
2016qcmo_15,Rookie Inspiration Award sponsored by National Instruments,frc5952,
2016qcmo_16,Industrial Design Award sponsored by General Motors,frc3360,
2016qcmo_17,Quality Award sponsored by Motorola Solutions Foundation,frc5865,
2016qcmo_18,Industrial Safety Award sponsored by Underwriters Laboratories,frc5553,
2016qcmo_2,Regional Finalists,frc3360,
2016qcmo_2,Regional Finalists,frc5910,
2016qcmo_2,Regional Finalists,frc5439,
2016qcmo_20,Creativity Award sponsored by Xerox,frc3981,
2016qcmo_21,Excellence in Engineering Award sponsored by Delphi,frc3158,
2016qcmo_22,Entrepreneurship Award sponsored by Kleiner Perkins Caufield and Byers,frc5618,
2016qcmo_27,Imagery Award in honor of Jack Kamen,frc3379,
2016qcmo_29,Innovation in Control Award sponsored by Rockwell Automation,frc4947,
2016qcmo_3,Woodie Flowers Finalist Award,frc3996,Daniel Carré
2016qcmo_30,Team Spirit Award sponsored by FCA Foundation,frc3386,
2016qcmo_4,FIRST Dean's List Finalist Award,frc5910,Piero Barrette
2016qcmo_4,FIRST Dean's List Finalist Award,frc296,Benjamin Lusterio-Adler
2016qcmo_5,Volunteer of the Year,,Jim Forbes
2016qcmo_68,Wildcard,frc3360,
2016qcmo_68,Wildcard,frc5439,
2016qcmo_9,Regional Engineering Inspiration Award,frc4001,
