2018vahay_0,District Chairman's Award,frc422,
2018vahay_1,District Event Winner,frc422,
2018vahay_1,District Event Winner,frc3274,
2018vahay_1,District Event Winner,frc141,
2018vahay_11,Gracious Professionalism Award sponsored by Johnson & Johnson,frc2534,
2018vahay_13,Judges' Award,frc1418,
2018vahay_14,Highest Rookie Seed,frc6893,
2018vahay_15,Rookie Inspiration Award sponsored by National Instruments,frc6893,
2018vahay_16,Industrial Design Award sponsored by General Motors,frc619,
2018vahay_17,Quality Award sponsored by Motorola Solutions Foundation,frc5546,
2018vahay_18,Safety Award sponsored by Underwriters Laboratories,frc422,
2018vahay_2,District Event Finalist,frc4472,
2018vahay_2,District Event Finalist,frc612,
2018vahay_2,District Event Finalist,frc6504,
2018vahay_20,Creativity Award sponsored by Xerox,frc4472,
2018vahay_21,Excellence in Engineering Award sponsored by Delphi,frc3373,
2018vahay_22,Entrepreneurship Award sponsored by Kleiner Perkins Caufield and Byers,frc2068,
2018vahay_27,Imagery Award in honor of Jack Kamen,frc5830,
2018vahay_29,Innovation in Control Award sponsored by Rockwell Automation,frc2363,
2018vahay_30,Team Spirit Award sponsored by FCA Foundation,frc316,
2018vahay_9,District Engineering Inspiration Award,frc888,
