2016vabla_0,District Chairman's Award,frc1086,
2016vabla_1,District Event Winner,frc346,
2016vabla_1,District Event Winner,frc1086,
2016vabla_1,District Event Winner,frc2534,
2016vabla_10,Rookie All Star Award,frc5950,
2016vabla_11,Gracious Professionalism Award sponsored by Johnson & Johnson,frc346,
2016vabla_13,Judges' Award,frc3361,
2016vabla_14,Highest Rookie Seed,frc5950,
2016vabla_15,Rookie Inspiration Award sponsored by National Instruments,frc6194,
2016vabla_16,Industrial Design Award sponsored by General Motors,frc422,
2016vabla_17,Quality Award sponsored by Motorola Solutions Foundation,frc3872,
2016vabla_18,Industrial Safety Award sponsored by Underwriters Laboratories,frc1086,
2016vabla_2,District Event Finalist,frc3455,
2016vabla_2,District Event Finalist,frc1262,
2016vabla_2,District Event Finalist,frc977,
2016vabla_20,Creativity Award sponsored by Xerox,frc2534,
2016vabla_21,Excellence in Engineering Award sponsored by Delphi,frc5279,
2016vabla_22,Entrepreneurship Award sponsored by Kleiner Perkins Caufield and Byers,frc339,
2016vabla_27,Imagery Award in honor of Jack Kamen,frc401,
2016vabla_29,Innovation in Control Award sponsored by Rockwell Automation,frc1731,
2016vabla_30,Team Spirit Award sponsored by FCA Foundation,frc384,
2016vabla_9,District Engineering Inspiration Award,frc540,
