2016casj_0,Regional Chairman's Award,frc2035,
2016casj_1,Regional Winners,frc1678,
2016casj_1,Regional Winners,frc254,
2016casj_1,Regional Winners,frc1662,
2016casj_10,Rookie All Star Award,frc5940,
2016casj_11,Gracious Professionalism Award sponsored by Johnson & Johnson,frc3482,
2016casj_13,Judges' Award,frc5677,
2016casj_14,Highest Rookie Seed,frc5924,
2016casj_15,Rookie Inspiration Award sponsored by National Instruments,frc5905,
2016casj_16,Industrial Design Award sponsored by General Motors,frc3303,
2016casj_17,Quality Award sponsored by Motorola Solutions Foundation,frc846,
2016casj_18,Industrial Safety Award sponsored by Underwriters Laboratories,frc3256,
2016casj_2,Regional Finalists,frc971,
2016casj_2,Regional Finalists,frc368,
2016casj_2,Regional Finalists,frc3303,
2016casj_20,Creativity Award sponsored by Xerox,frc5700,
2016casj_21,Excellence in Engineering Award sponsored by Delphi,frc1678,
2016casj_22,Entrepreneurship Award sponsored by Kleiner Perkins Caufield and Byers,frc1868,
2016casj_27,Imagery Award in honor of Jack Kamen,frc649,
2016casj_29,Innovation in Control Award sponsored by Rockwell Automation,frc4904,
2016casj_3,Woodie Flowers Finalist Award,frc1868,Ann Wettersten
2016casj_30,Team Spirit Award sponsored by FCA Foundation,frc1967,
2016casj_4,FIRST Dean's List Finalist Award,frc1868,Divya Mohan
2016casj_4,FIRST Dean's List Finalist Award,frc115,Akhil Palla
2016casj_5,Volunteer of the Year,,John Canfield
2016casj_68,Wildcard,frc368,
2016casj_68,Wildcard,frc3303,
2016casj_9,Regional Engineering Inspiration Award,frc4159,
