2017onbar_0,District Chairman's Award,frc1241,
2017onbar_1,District Event Winner,frc4976,
2017onbar_1,District Event Winner,frc5406,
2017onbar_1,District Event Winner,frc3560,
2017onbar_10,Rookie All Star Award,frc6336,
2017onbar_11,Gracious Professionalism Award sponsored by Johnson & Johnson,frc781,
2017onbar_13,Judges' Award,frc771,
2017onbar_14,Highest Rookie Seed,frc6513,
2017onbar_15,Rookie Inspiration Award sponsored by National Instruments,frc6513,
2017onbar_16,Industrial Design Award sponsored by General Motors,frc1285,
2017onbar_17,Quality Award sponsored by Motorola Solutions Foundation,frc1325,
2017onbar_18,Safety Award sponsored by Underwriters Laboratories,frc2994,
2017onbar_2,District Event Finalist,frc1285,
2017onbar_2,District Event Finalist,frc865,
2017onbar_2,District Event Finalist,frc4152,
2017onbar_20,Creativity Award sponsored by Xerox,frc865,
2017onbar_21,Excellence in Engineering Award sponsored by Delphi,frc4946,
2017onbar_22,Entrepreneurship Award sponsored by Kleiner Perkins Caufield and Byers,frc2706,
2017onbar_27,Imagery Award in honor of Jack Kamen,frc3543,
2017onbar_29,Innovation in Control Award sponsored by Rockwell Automation,frc4976,
2017onbar_30,Team Spirit Award sponsored by FCA Foundation,frc4001,
2017onbar_9,District Engineering Inspiration Award,frc5870,
