2017mabri_0,District Chairman's Award,frc4176,
2017mabri_1,District Event Winner,frc2168,
2017mabri_1,District Event Winner,frc88,
2017mabri_1,District Event Winner,frc5563,
2017mabri_10,Rookie All Star Award,frc6333,
2017mabri_11,Gracious Professionalism Award sponsored by Johnson & Johnson,frc5112,
2017mabri_13,Judges' Award,frc5846,
2017mabri_14,Highest Rookie Seed,frc6529,
2017mabri_16,Industrial Design Award sponsored by General Motors,frc172,
2017mabri_17,Quality Award sponsored by Motorola Solutions Foundation,frc78,
2017mabri_18,Safety Award sponsored by Underwriters Laboratories,frc4169,
2017mabri_2,District Event Finalist,frc4151,
2017mabri_2,District Event Finalist,frc4169,
2017mabri_2,District Event Finalist,frc4176,
2017mabri_20,Creativity Award sponsored by Xerox,frc6201,
2017mabri_21,Excellence in Engineering Award sponsored by Delphi,frc348,
2017mabri_22,Entrepreneurship Award sponsored by Kleiner Perkins Caufield and Byers,frc4761,
2017mabri_27,Imagery Award in honor of Jack Kamen,frc2079,
2017mabri_29,Innovation in Control Award sponsored by Rockwell Automation,frc2648,
2017mabri_30,Team Spirit Award sponsored by FCA Foundation,frc4151,
2017mabri_9,District Engineering Inspiration Award,frc3461,
