2017gacol_0,District Chairman's Award,frc1648,
2017gacol_1,District Event Winner,frc4910,
2017gacol_1,District Event Winner,frc6340,
2017gacol_1,District Event Winner,frc3091,
2017gacol_10,Rookie All Star Award,frc6349,
2017gacol_11,Gracious Professionalism Award sponsored by Johnson & Johnson,frc2415,
2017gacol_13,Judges' Award,frc1002,
2017gacol_14,Highest Rookie Seed,frc6325,
2017gacol_15,Rookie Inspiration Award sponsored by National Instruments,frc6325,
2017gacol_16,Industrial Design Award sponsored by General Motors,frc1746,
2017gacol_17,Quality Award sponsored by Motorola Solutions Foundation,frc4188,
2017gacol_18,Safety Award sponsored by Underwriters Laboratories,frc5582,
2017gacol_2,District Event Finalist,frc1746,
2017gacol_2,District Event Finalist,frc4188,
2017gacol_2,District Event Finalist,frc6177,
2017gacol_20,Creativity Award sponsored by Xerox,frc1414,
2017gacol_21,Excellence in Engineering Award sponsored by Delphi,frc1683,
2017gacol_22,Entrepreneurship Award sponsored by Kleiner Perkins Caufield and Byers,frc1648,
2017gacol_27,Imagery Award in honor of Jack Kamen,frc5582,
2017gacol_29,Innovation in Control Award sponsored by Rockwell Automation,frc4026,
2017gacol_30,Team Spirit Award sponsored by FCA Foundation,frc5632,
2017gacol_9,District Engineering Inspiration Award,frc4910,
