2016code_0,Regional Chairman's Award,frc4499,
2016code_1,Regional Winners,frc1619,
2016code_1,Regional Winners,frc1011,
2016code_1,Regional Winners,frc4550,
2016code_10,Rookie All Star Award,frc5899,
2016code_11,Gracious Professionalism Award sponsored by Johnson & Johnson,frc4388,
2016code_13,Judges' Award,frc5493,
2016code_14,Highest Rookie Seed,frc5899,
2016code_15,Rookie Inspiration Award sponsored by National Instruments,,
2016code_16,Industrial Design Award sponsored by General Motors,frc2240,
2016code_17,Quality Award sponsored by Motorola Solutions Foundation,frc1592,
2016code_18,Industrial Safety Award sponsored by Underwriters Laboratories,frc1410,
2016code_2,Regional Finalists,frc3288,
2016code_2,Regional Finalists,frc4499,
2016code_2,Regional Finalists,frc1339,
2016code_20,Creativity Award sponsored by Xerox,frc1245,
2016code_21,Excellence in Engineering Award sponsored by Delphi,frc1011,
2016code_22,Entrepreneurship Award sponsored by Kleiner Perkins Caufield and Byers,frc1410,
2016code_27,Imagery Award in honor of Jack Kamen,frc4550,
2016code_29,Innovation in Control Award sponsored by Rockwell Automation,frc1619,
2016code_3,Woodie Flowers Finalist Award,frc1619,Teresa Ewing
2016code_30,Team Spirit Award sponsored by FCA Foundation,frc1332,
2016code_4,FIRST Dean's List Finalist Award,frc2996,Ryan Kight
2016code_4,FIRST Dean's List Finalist Award,frc1011,Emma Galligan
2016code_5,Volunteer of the Year,,James Calder
2016code_68,Wildcard,frc3288,
2016code_68,Wildcard,frc1339,
2016code_9,Regional Engineering Inspiration Award,frc2996,
