2017micmp1_1,District Championship Winner,frc4391,
2017micmp1_1,District Championship Winner,frc85,
2017micmp1_1,District Championship Winner,frc2619,
2017micmp1_11,Gracious Professionalism Award sponsored by Johnson & Johnson,frc1718,
2017micmp1_13,Judges' Award,frc4680,
2017micmp1_14,Highest Rookie Seed,frc6548,
2017micmp1_15,Rookie Inspiration Award sponsored by National Instruments,frc6753,
2017micmp1_16,Industrial Design Award sponsored by General Motors,frc5066,
2017micmp1_17,Quality Award sponsored by Motorola Solutions Foundation,frc5980,
2017micmp1_18,Safety Award sponsored by Underwriters Laboratories,frc4237,
2017micmp1_2,District Championship Finalist,frc217,
2017micmp1_2,District Championship Finalist,frc910,
2017micmp1_2,District Championship Finalist,frc4237,
2017micmp1_20,Creativity Award sponsored by Xerox,frc5162,
2017micmp1_21,Excellence in Engineering Award sponsored by Delphi,frc217,
2017micmp1_22,Entrepreneurship Award sponsored by Kleiner Perkins Caufield and Byers,frc302,
2017micmp1_27,Imagery Award in honor of Jack Kamen,frc4381,
2017micmp1_29,Innovation in Control Award sponsored by Rockwell Automation,frc910,
2017micmp1_30,Team Spirit Award sponsored by FCA Foundation,frc3414,
