2016pawch_0,District Chairman's Award,frc1218,
2016pawch_1,District Event Winner,frc225,
2016pawch_1,District Event Winner,frc1640,
2016pawch_1,District Event Winner,frc1391,
2016pawch_11,Gracious Professionalism Award sponsored by Johnson & Johnson,frc5181,
2016pawch_13,Judges' Award,frc1391,
2016pawch_16,Industrial Design Award sponsored by General Motors,frc225,
2016pawch_17,Quality Award sponsored by Motorola Solutions Foundation,frc1640,
2016pawch_18,Industrial Safety Award sponsored by Underwriters Laboratories,frc4373,
2016pawch_2,District Event Finalist,frc4954,
2016pawch_2,District Event Finalist,frc341,
2016pawch_2,District Event Finalist,frc484,
2016pawch_20,Creativity Award sponsored by Xerox,frc5404,
2016pawch_21,Excellence in Engineering Award sponsored by Delphi,frc708,
2016pawch_22,Entrepreneurship Award sponsored by Kleiner Perkins Caufield and Byers,frc103,
2016pawch_27,Imagery Award in honor of Jack Kamen,frc341,
2016pawch_29,Innovation in Control Award sponsored by Rockwell Automation,frc2607,
2016pawch_30,Team Spirit Award sponsored by FCA Foundation,frc433,
2016pawch_9,District Engineering Inspiration Award,frc272,
