2015tnkn_0,Regional Chairman's Award,frc1311,
2015tnkn_1,Regional Winners,frc3824,
2015tnkn_1,Regional Winners,frc2614,
2015tnkn_1,Regional Winners,frc3492,
2015tnkn_10,Rookie All Star Award,frc5571,
2015tnkn_11,Gracious Professionalism Award sponsored by Johnson & Johnson,frc2614,
2015tnkn_13,Judges' Award,frc5338,
2015tnkn_13,Judges' Award,frc5691,
2015tnkn_14,Highest Rookie Seed,frc5492,
2015tnkn_15,Rookie Inspiration Award,frc5492,
2015tnkn_16,Industrial Design Award sponsored by General Motors,frc3959,
2015tnkn_17,Quality Award sponsored by Motorola,frc3140,
2015tnkn_18,Industrial Safety Award sponsored by Underwriters Laboratories,frc3824,
2015tnkn_2,Regional Finalists,frc3959,
2015tnkn_2,Regional Finalists,frc5338,
2015tnkn_2,Regional Finalists,frc3201,
2015tnkn_20,Creativity Award sponsored by Xerox,frc4462,
2015tnkn_21,Excellence in Engineering Award sponsored by Delphi,frc3824,
2015tnkn_22,Entrepreneurship Award sponsored by Kleiner Perkins Caufield and Byers,frc2393,
2015tnkn_27,Imagery Award in honor of Jack Kamen,frc3966,
2015tnkn_29,Innovation in Control Award sponsored by Rockwell Automation,frc456,
2015tnkn_3,Woodie Flowers Finalist Award,frc2614,Phillip Tucker
2015tnkn_30,Team Spirit Award sponsored by Chrysler,frc4504,
2015tnkn_4,FIRST Dean's List Finalist Award,frc4265,Luke Buckner
2015tnkn_4,FIRST Dean's List Finalist Award,frc2783,Marie Hansen
2015tnkn_5,Volunteer of the Year,,Dr. Roger Parsons
2015tnkn_9,Regional Engineering Inspiration Award,frc4265,
