2016mista_0,District Chairman's Award,frc3618,
2016mista_1,District Event Winner,frc1918,
2016mista_1,District Event Winner,frc4377,
2016mista_1,District Event Winner,frc5166,
2016mista_10,Rookie All Star Award,frc6121,
2016mista_11,Gracious Professionalism Award sponsored by Johnson & Johnson,frc107,
2016mista_13,Judges' Award,frc5504,
2016mista_14,Highest Rookie Seed,frc6193,
2016mista_15,Rookie Inspiration Award sponsored by National Instruments,frc6071,
2016mista_16,Industrial Design Award sponsored by General Motors,frc1918,
2016mista_17,Quality Award sponsored by Motorola Solutions Foundation,frc3770,
2016mista_18,Industrial Safety Award sponsored by Underwriters Laboratories,frc4377,
2016mista_2,District Event Finalist,frc5448,
2016mista_2,District Event Finalist,frc6098,
2016mista_2,District Event Finalist,frc862,
2016mista_20,Creativity Award sponsored by Xerox,frc5661,
2016mista_21,Excellence in Engineering Award sponsored by Delphi,frc5166,
2016mista_22,Entrepreneurship Award sponsored by Kleiner Perkins Caufield and Byers,frc4377,
2016mista_27,Imagery Award in honor of Jack Kamen,frc5448,
2016mista_29,Innovation in Control Award sponsored by Rockwell Automation,frc862,
2016mista_30,Team Spirit Award sponsored by FCA Foundation,frc2619,
2016mista_9,District Engineering Inspiration Award,frc3602,
